{
  "schema_version": "equivr-result/v1",
  "status": "FAIL",
  "contract": {
    "version": "equivr-contract/v1",
    "name": "missing_rows",
    "sha256": "2a022ad84dbf89964d8811b55addd9d3e345167417b04067b1bed9dab94de978"
  },
  "artifacts": {
    "reference": {
      "source": "reference.csv",
      "format": "csv",
      "sha256": "247d03c5146dd6810e9a725a46bc7c280289e715d25bfa3e7c9c9ea1ab942530",
      "n_rows": 3,
      "n_cols": 4,
      "columns": [
        "id",
        "estimate",
        "count",
        "group"
      ]
    },
    "candidate": {
      "source": "candidate.csv",
      "format": "csv",
      "sha256": "b2fd52d678a4f2a1f8048b86d610380f990f09ebf72cf781d8453c5201397ed3",
      "n_rows": 3,
      "n_cols": 4,
      "columns": [
        "id",
        "estimate",
        "count",
        "group"
      ]
    }
  },
  "summary": {
    "n_checks": 11,
    "n_passed": 9,
    "failed_required": [
      "rows.missing_in_candidate",
      "rows.extra_in_candidate"
    ],
    "failed_optional": []
  },
  "checks": [
    {
      "id": "schema.missing_fields",
      "required": true,
      "status": "pass",
      "n_mismatch": 0,
      "fields": [],
      "message": "OK",
      "diagnostics": [],
      "n_diagnostics_omitted": 0
    },
    {
      "id": "schema.extra_fields",
      "required": true,
      "status": "pass",
      "n_mismatch": 0,
      "fields": [],
      "message": "OK",
      "diagnostics": [],
      "n_diagnostics_omitted": 0
    },
    {
      "id": "schema.type_mismatch",
      "required": true,
      "status": "pass",
      "n_mismatch": 0,
      "fields": [],
      "message": "OK",
      "diagnostics": [],
      "n_diagnostics_omitted": 0
    },
    {
      "id": "keys.present",
      "required": true,
      "status": "pass",
      "n_mismatch": 0,
      "fields": [],
      "message": "OK",
      "diagnostics": [],
      "n_diagnostics_omitted": 0
    },
    {
      "id": "keys.unique_reference",
      "required": true,
      "status": "pass",
      "n_mismatch": 0,
      "fields": [],
      "message": "OK",
      "diagnostics": [],
      "n_diagnostics_omitted": 0
    },
    {
      "id": "keys.unique_candidate",
      "required": true,
      "status": "pass",
      "n_mismatch": 0,
      "fields": [],
      "message": "OK",
      "diagnostics": [],
      "n_diagnostics_omitted": 0
    },
    {
      "id": "rows.missing_in_candidate",
      "required": true,
      "status": "fail",
      "n_mismatch": 1,
      "fields": [],
      "message": "1 reference row(s) missing in candidate.",
      "diagnostics": [
        {
          "key": {
            "id": "C"
          }
        }
      ],
      "n_diagnostics_omitted": 0
    },
    {
      "id": "rows.extra_in_candidate",
      "required": true,
      "status": "fail",
      "n_mismatch": 1,
      "fields": [],
      "message": "1 extra candidate row(s).",
      "diagnostics": [
        {
          "key": {
            "id": "D"
          }
        }
      ],
      "n_diagnostics_omitted": 0
    },
    {
      "id": "values.missingness",
      "required": true,
      "status": "pass",
      "n_mismatch": 0,
      "fields": [],
      "message": "OK",
      "diagnostics": [],
      "n_diagnostics_omitted": 0
    },
    {
      "id": "values.exact",
      "required": true,
      "status": "pass",
      "n_mismatch": 0,
      "fields": [],
      "message": "OK",
      "diagnostics": [],
      "n_diagnostics_omitted": 0
    },
    {
      "id": "values.numeric",
      "required": true,
      "status": "pass",
      "n_mismatch": 0,
      "fields": [],
      "message": "OK",
      "diagnostics": [],
      "n_diagnostics_omitted": 0
    }
  ]
}
