{
  "schema_version": "equivr-result/v1",
  "status": "FAIL",
  "contract": {
    "version": "equivr-contract/v1",
    "name": "missingness_mismatch",
    "sha256": "43728b09ccae3d1d75661c8f9fba48156a634e4b692a47b7f12a01a5fc98bfc2"
  },
  "artifacts": {
    "reference": {
      "source": "reference.csv",
      "format": "csv",
      "sha256": "247d03c5146dd6810e9a725a46bc7c280289e715d25bfa3e7c9c9ea1ab942530",
      "n_rows": 3,
      "n_cols": 4,
      "columns": [
        "id",
        "estimate",
        "count",
        "group"
      ]
    },
    "candidate": {
      "source": "candidate.csv",
      "format": "csv",
      "sha256": "1eaf18d46b54c71f23ea1f48e3bf687ff8bbd770ea1e5ea4ae6e7f61f063ab09",
      "n_rows": 3,
      "n_cols": 4,
      "columns": [
        "id",
        "estimate",
        "count",
        "group"
      ]
    }
  },
  "summary": {
    "n_checks": 11,
    "n_passed": 10,
    "failed_required": [
      "values.missingness"
    ],
    "failed_optional": []
  },
  "checks": [
    {
      "id": "schema.missing_fields",
      "required": true,
      "status": "pass",
      "n_mismatch": 0,
      "fields": [],
      "message": "OK",
      "diagnostics": [],
      "n_diagnostics_omitted": 0
    },
    {
      "id": "schema.extra_fields",
      "required": true,
      "status": "pass",
      "n_mismatch": 0,
      "fields": [],
      "message": "OK",
      "diagnostics": [],
      "n_diagnostics_omitted": 0
    },
    {
      "id": "schema.type_mismatch",
      "required": true,
      "status": "pass",
      "n_mismatch": 0,
      "fields": [],
      "message": "OK",
      "diagnostics": [],
      "n_diagnostics_omitted": 0
    },
    {
      "id": "keys.present",
      "required": true,
      "status": "pass",
      "n_mismatch": 0,
      "fields": [],
      "message": "OK",
      "diagnostics": [],
      "n_diagnostics_omitted": 0
    },
    {
      "id": "keys.unique_reference",
      "required": true,
      "status": "pass",
      "n_mismatch": 0,
      "fields": [],
      "message": "OK",
      "diagnostics": [],
      "n_diagnostics_omitted": 0
    },
    {
      "id": "keys.unique_candidate",
      "required": true,
      "status": "pass",
      "n_mismatch": 0,
      "fields": [],
      "message": "OK",
      "diagnostics": [],
      "n_diagnostics_omitted": 0
    },
    {
      "id": "rows.missing_in_candidate",
      "required": true,
      "status": "pass",
      "n_mismatch": 0,
      "fields": [],
      "message": "OK",
      "diagnostics": [],
      "n_diagnostics_omitted": 0
    },
    {
      "id": "rows.extra_in_candidate",
      "required": true,
      "status": "pass",
      "n_mismatch": 0,
      "fields": [],
      "message": "OK",
      "diagnostics": [],
      "n_diagnostics_omitted": 0
    },
    {
      "id": "values.missingness",
      "required": true,
      "status": "fail",
      "n_mismatch": 2,
      "fields": [
        "estimate",
        "group"
      ],
      "message": "2 missing-value mismatch(es) in: estimate, group.",
      "diagnostics": [
        {
          "field": "estimate",
          "key": {
            "id": "B"
          },
          "reference": 2,
          "candidate": null
        },
        {
          "field": "group",
          "key": {
            "id": "C"
          },
          "reference": "z",
          "candidate": null
        }
      ],
      "n_diagnostics_omitted": 0
    },
    {
      "id": "values.exact",
      "required": true,
      "status": "pass",
      "n_mismatch": 0,
      "fields": [],
      "message": "OK",
      "diagnostics": [],
      "n_diagnostics_omitted": 0
    },
    {
      "id": "values.numeric",
      "required": true,
      "status": "pass",
      "n_mismatch": 0,
      "fields": [],
      "message": "OK",
      "diagnostics": [],
      "n_diagnostics_omitted": 0
    }
  ]
}
